what tv show did joey lawrence play on?	['Blossom', 'Melissa & Joey', 'Bow', 'Gimme a Break!', 'Run of the House', 'Brotherly Love']
what instruments does john williams use?	['Trombone', 'Piano', 'trumpet', 'clarinet']
what language do they speak in spain wikipedia?	['Spanish Language']
what are taylor swift's albums?	['Stripped Raw & Real', 'Ronan', 'CMT Crossroads', 'Speak Now - World Tour Live', 'Fearless', 'iTunes Live From SoHo', 'Beautiful Eyes', 'We Are Never Ever Getting Back Together', 'Speak Now', 'Red']
who played kitt in knight rider?	['William Daniels']
where did john boehner come from?	['Ohio']
what did the harlem renaissance created?	['Harlem Renaissance Dialogues (Part 1): Living and Writing Black History']
what airlines fly into ontario international airport?	['West Air', 'Great Lakes Airlines', 'Ameriflight', 'UPS Airlines']
what team does kris humphries play for in 2011?	['Brooklyn Nets']
what to do in new orleans with kids?	['Belle of the Nineties']
what movie did rihanna play in?	['This Is the End', 'Battleship', 'Happy Smekday!']
which countries does south africa export to?	['Tanzania', 'Angola']
what type of government does fiji have 2010?	['Military dictatorship', 'Military junta', 'Parliamentary republic']
who did rufus wainwright married?	['Jörn Weisbrodt']
where did the florida marlins?	['Miami']
who played violet's mother in charlie and the chocolate factory?	['Kansas City Athletics']
what did shawnee smith star in?	"['The Grudge 3', 'Saw IV', 'Summer School', 'Saw II', 'Saw III', 'The Island', 'Saw', 'The Blob', ""Who's Harry Crumb?""]"
what is pennsylvania's state flower called?	['Kalmia latifolia']
what movies did james franco play in?	['Tristan & Isolde', 'Pineapple Express', 'The Great Raid', 'Annapolis', 'Whatever It Takes', 'The Company', 'An American Crime', 'Spider-Man', 'Spider-Man 2', 'Spider-Man 3']
what year did john glenn walk on the moon?	['1976 Democratic National Convention']
what art movement was vincent van gogh apart of?	['Post-Impressionism']
when did the 7th harry potter book come out?	['The gospel according to Harry Potter']
where did gary coleman live when he died?	['Provo']
where did willy wonka take place?	['Chocolate Factory Universe']
what is the name of the alabama state tree?	['Pinus palustris']
who is the speaker of the house of representatives currently?	['Nancy Pelosi']
when did the orioles win the pennant?	['1983 World Series', '1966 World Series', '1970 World Series']
where did carrie underwood live?	['Checotah']
where did bruno mars get his start?	['Honolulu']
what city is mt st helens in?	['Skamania County']
what to do in panama city beach for spring break?	['Thunder Beach Motorcycle Rally', 'Club La Vela', 'Man in the Sea Museum', 'Camp Helen State Park', 'Pier Park', 'Shipwreck Island', 'Latimer Cabin', 'St. Andrews State Park', 'Miracle Strip at Pier Park']
where does manny pacquiao live?	['South Cotabato', 'Kiamba']
when did tamu admit women?	['Myanmar']
when was tom brady first superbowl win?	['Super Bowl XXXVI']
what political experience did abraham lincoln have?	['United States Representative', 'President of the United States', 'Member of Illinois House of Representatives']
where is the best place to stay in aruba?	['Oranjestad']
what theme songs did alan thicke wrote?	"[""It Takes Diff'rent Strokes""]"
what happened to justin bieber 2012?	['Billboard Music Award for Top Social Artist']
what type of government does israel?	['Parliamentary system', 'Democracy']
in which state did the santa fe trail begin?	['New Mexico']
which countries does russia border?	['Ukraine', 'Belarus', 'Kazakhstan', 'Poland', 'Lithuania', 'Azerbaijan', 'Mongolia', 'North Korea', 'Georgia', 'Norway']
what timezone is tennessee nashville?	['Central Time Zone']
what years did the knicks win the championship?	['1970 NBA Finals', '1973 NBA Finals']
what books did frances hodgson burnett wrote?	['The Secret Garden']
where do navajo indians live?	['Arizona', 'Utah', 'Southwestern United States', 'Navajo Nation', 'California', 'New Mexico']
what timezone is the state of texas?	['Central Time Zone']
what is the legislature of missouri called?	['Missouri General Assembly']
what are the best places to go in germany?	['Topography of Terror']
when are school holidays in uk 2011?	['Denbighshire']
what george washington carver famous for?	['Peanut butter']
where is ann romney from?	['Metro Detroit']
who plays lola bunny on the looney tunes show?	['Britt McKillip', 'Kath Soucie']
where was saint joseph from?	['Canaan']
what did florence sabin do?	['Physician']
what is wrong with robin roberts?	['Breast cancer', 'Myelodysplastic syndrome']
what type of legal system does italy have?	['Constitutional republic', 'Parliamentary republic', 'Unitary state']
what is the name of the new orleans saints football stadium?	['Mercedes-Benz Superdome']
what is jonathan swift famous for?	['Pamphleteer']
where does jeb bush live?	['Midland']
what is the name of the capital of spain?	['Madrid']
what happened at fukushima daiichi nuclear plant?	['2011 Tōhoku earthquake and tsunami']
what are the gods of islam?	['Allah']
what does the zambezi river flow into?	['Namibia']
where was hockey world cup 2010 held?	['The Cup']
who is the governor of california 2010?	['Arnold Schwarzenegger']
what is tibetan language?	['Nepali Language', 'Standard Tibetan', 'Chinese language', 'Baima language', 'Tibetan languages']
who was peter frampton married to?	['Christina Elfers', 'Mary Lovett', 'Barbara Gold']
when did mcdonalds officially open?	['5/15/1940']
where was emperor hadrian born?	['Rome']
what country vasco da gama sail for?	['Portugal']
what religion did jesus christ follow?	['Judaism']
where was adolf hitler died?	['Berlin']
what are some of the religions in australia?	['Catholicism', 'Buddhism', 'Islam', 'Anglicanism']
what time does barnes and noble close on saturday?	['Central High School', 'University of Pennsylvania']
what art movements was henri matisse involved in?	['Fauvism', 'Impressionism', 'Neo-impressionism', 'Modernism']
what team did joe hart play for before man city?	['Shrewsbury Town F.C.']
what was antonio vivaldi known for?	['Priest']
where did walt disney live before he died?	['Chicago', 'Kansas City', 'France', 'Holmby Hills', 'Marceline', 'Hermosa']
what would have happened if germany had won ww1?	['de']
when do we change the clocks in 2011 in australia?	['au']
who was the first jedi master?	['Yoda']
who plays marlo on the wire?	['Jamie Hector']
who was the communist dictator of north korea?	['Kim Jong-il']
what movies does zac efron star in?	"['17 Again', 'Charlie St. Cloud', 'Miracle Run', 'Me and Orson Welles', ""Melinda's World"", 'High School Musical', 'The Derby Stallion', 'High School Musical 2', 'High School Musical 3: Senior Year', 'Hairspray']"
where was benjamin franklin raised?	['Boston']
what is shakespeare's parents names?	['John Shakespeare', 'Mary Shakespeare']
when did the celtics win championship?	['1969 NBA Finals', '1986 NBA Finals', '2008 NBA Finals', '1974 NBA Finals', '1984 NBA Finals', '1965 NBA Finals', '1966 NBA Finals', '1976 NBA Finals', '1981 NBA Finals', '1968 NBA Finals']
what was basketball player michael jordan's major in college?	['Cultural geography']
what is jill wagner on wipeout?	['Him/Herself']
where does nick diaz fight?	['UFC 62: Liddell vs. Sobral', 'Unpleasantville', 'UFC 57: Couture vs. Liddell 3', 'UFC 53: Heavy Hitters', 'Elite XC: Uprising: Rua vs. Lawler', 'UFC: The Ultimate 100 Greatest Fights: Vol. 2', 'Elite XC: Return of the King: Noons vs. Edwards', 'Fight Life', 'Elite XC: Lawler vs Smith II', 'UFC 59: Reality Check']
when does summer start in new england?	['Waltham']
what years did the orioles play in the world series?	['1983 World Series', '1966 World Series', '1970 World Series']
who has coached the minnesota vikings?	['Harrison Smith', 'Devin Aromashodu', 'Chris Kluwe', 'Joe Webb', 'Christian Ponder', 'Josh Robinson', 'Jarius Wright', 'McLeod Bethel-Thompson', 'Blair Walsh', 'Stephen Burton']
who is democritus and what did he discover?	['Mathematician']
what are some places to visit in barcelona?	"['Museu Picasso', 'Gothic Quarter, Barcelona', 'Park Güell', 'La Rambla', 'Palau de la Música Catalana', 'Sagrada Família', ""Plaça d'Espanya, Barcelona"", 'Barcelona Museum of Contemporary Art', 'Casa Milà', ""Museu Nacional d'Art de Catalunya""]"
where is luke afb arizona?	['Glendale']
who was joseph pulitzer and what did he do?	['Publisher', 'Politician', 'Journalist', 'Lawyer']
where is puerto galera?	['Philippines', 'Oriental Mindoro']
what school did sir isaac newton go to?	"[""The King's School, Grantham"", 'Trinity College, Cambridge']"
what is the currency of sweden called?	['Swedish krona']
who runs china 2011?	['Wen Jiabao']
where did sergio romo go to college?	['University of North Alabama']
what is the name of the book hitler wrote while in prison?	['Mein Kampf']
what is the main language spoken in italy?	['Italian Language']
where does the roman language come from?	['Latin Language']
where is shoreditch?	['London']
who is prime minister of japan 2012?	['Shinzō Abe']
what time period did jesus live in?	['4 BCE']
what did michelle obama do?	['First Lady of the United States']
where do most earthquakes happen in japan?	['Hokkaido']
where does the zambezi river begin?	['Mwinilunga']
what organization did martin luther king lead?	['Civil rights movement', 'Civil disobedience', 'Nonviolence']
what is the capital city of texas usa?	['Austin']
where was my honda motorcycle made?	['Tokyo']
what instrument does ringo starr play?	['Drums']
who was cleopatra married too?	['Mark Antony']
what college did kevjumba?	['University of California, Davis']
who was emperor diocletian?	['Roman emperor']
what to do when traveling to london?	"[""Regent's Park"", 'Tower of London', 'Buckingham Palace', 'Palace of Westminster', 'London Eye', 'Tower Bridge', 'Hyde Park', 'Westminster Abbey', ""St Paul's Cathedral"", 'Trafalgar Square']"
who is married to garth brooks?	['Trisha Yearwood']
what kind of currency to bring to mexico?	['Mexican peso']
what are the names of all the countries in africa?	['Angola', 'Côte d’Ivoire', 'Central African Republic', 'Burkina Faso', 'Djibouti', 'Congo', 'Burundi', 'Botswana', 'Cape Verde', 'Benin']
where is roger federer from sui?	['Basel']
where jay z was raised?	['Brooklyn']
what has lucy hale played in?	['A Cinderella Story: Once Upon A Song', '10 Years', 'Sorority Wars', 'The Sisterhood of the Traveling Pants 2', 'Scream 4', 'Fear Island', 'Tinker Bell: Secret of the Wings', 'Killer in the Family']
who was the owner of kfc?	['Colonel Sanders']
who is the owner of the philadelphia eagles?	['Jeffrey Lurie']
what is kareem abdul jabbar real name?	['Ferdinand Lewis Alcindor, Sr.']
who plays paul blart?	['Kevin James']
what does donald trump own?	['Trump Tower', 'The Trump Organization', 'Trump Entertainment Resorts']
who inspired antonio vivaldi?	['Johann Sebastian Bach']
who sang at the mtv movie awards 2011?	"['Twisted Sister', 'Suicidal Tendencies', ""Guns N' Roses"", 'Red Hot Chili Peppers', 'AC/DC', 'Nirvana', 'Run-D.M.C.', 'Ice Cube', 'The Offspring', 'Metallica']"
who does zach galifianakis play in the hangover?	['Alan Garner']
when does the russian league start?	['ru', 'su', '.рф']
where does turkish language?	['Turkey']
who are betty white's husbands?	['Lane Allen', 'Allen Ludden', 'Dick Barker']
what job does janelle brown have?	['Singer', 'Actor']
what did isaac newton contribute to science?	"['Newton fractal', 'Newton–Euler equations', ""Newton's laws of motion"", ""Newton's cannonball"", 'Newton', ""Newton's inequalities"", ""Newton's notation"", 'Newton polygon', 'Newton disc']"
where did ayn rand live?	['Saint Petersburg']
what team rasheed wallace?	['Portland Trail Blazers', 'New York Knicks', 'Washington Wizards', 'Atlanta Hawks', 'Detroit Pistons', 'Boston Celtics']
who is engaged to john legend?	['Christine Teigen']
what songs did mozart write?	['1034 Mozartia']
what jersey will the packers wear in the super bowl?	['Dark green']
what cities are included in maricopa county?	['El Mirage', 'Cashion', 'Gila Bend', 'Arlington', 'Gilbert', 'Guadalupe', 'Buckeye', 'Glendale', 'Avondale', 'Chandler']
what is the parliament of canada called?	['Parliament of Canada']
what country was george washington from?	['Kingdom of Great Britain']
where did cutler jay go to college?	['Vanderbilt University']
what party was winston churchill in politics?	['Conservative Party']
who won london mayoral elections 2012?	['Stephen Foster']
when did the mets win the pennant?	['1969 World Series', '1986 World Series']
who does christopher walken play in batman returns?	['Max Shreck']
where does lala anthony live?	['Brooklyn']
what is the major language spoken in canada?	['French Language', 'English Language']
what would happen if the new madrid fault had an earthquake?	['Winter in Madrid']
what albums did john frusciante play on?	['Curtains', 'Smile From the Streets You Hold', 'Going Inside EP', 'From the Sounds Inside', 'Niandra LaDes and Usually Just a T-Shirt', 'DC EP', 'Inside of Emptiness', 'To Record Only Water for Ten Days', 'Shadows Collide With People', 'Demo & Acoustic Shadows Collide With People']
what language does people from denmark speak?	['Greenlandic language', 'Faroese', 'German Language', 'Danish Language']
what does a american rottweiler look like?	['Tan', 'Black', 'Mahogany']
who was the leader of the soviet union in 1945?	['Joseph Stalin']
where is riley's farm located?	['Sunnydale']
who plays noah bennet?	['Jack Coleman']
what did donna summers die from?	['Lung cancer', 'Cancer']
who did elvis presley really love?	['Ginger Alden']
what kind of government is china?	['Single-party state', 'Communist state', 'Socialist state']
where did barack obama went to school?	['Occidental College', 'Harvard Law School', 'Noelani Elementary School', 'Punahou School', 'State Elementary School Menteng 01', 'St. Francis of Assisi Catholic School', 'Columbia University']
what did jordyn wieber win gold for?	"[""Gymnastics at the 2012 Summer Olympics – Women's artistic team all-around""]"
who does brandon dubinsky play for?	['New York Rangers']
when does nasdaq start trading?	['1971']
what landforms are found in italy?	['Italian Peninsula']
what education does jeff corwin have?	['Norwell High School', 'Bridgewater State College', 'University of Massachusetts Amherst']
who are senators from new jersey?	['Joseph S. Frelinghuysen', 'Frederick Frelinghuysen', 'Frank Lautenberg', 'Jon Corzine', 'Frederick T. Frelinghuysen', 'Jonathan Elmer', 'Philemon Dickinson', 'William Paterson', 'John Rutherfurd', 'Bob Menendez']
who won the state of texas in 2008?	['Esperanza Andrade']
what currency should i take to jamaica?	['Jamaican dollar']
who did megan fox have a baby with?	['Brian Austin Green']
what to see in vietnam in two weeks?	['Hanoi']
who does michael oher play for in 2009?	['Baltimore Ravens']
what films have taylor lautner starred in?	"['New Moon', ""He's a Bully, Charlie Brown"", 'Eclipse', 'Cheaper by the Dozen 2', 'Incarceron', 'The Adventures of Sharkboy and Lavagirl', 'Dear Eleanor', 'Abduction', 'Shadow Fury', 'Field of Dreams 2: Lockout']"
where did johann sebastian bach live?	['Arnstadt', 'Köthen (Anhalt)', 'Leipzig', 'Weimar', 'Mühlhausen', 'Eisenach', 'Lüneburg', 'Ohrdruf']
what is the australian open called?	['2012 Australian Open']
what was the name of tecumseh brother?	['Tenskwatawa']
what did george steinbrenner do?	['Entrepreneur', 'Theatrical producer', 'Businessperson', 'Investor']
what kind of insurance does geico offer?	['Fire, Marine, and Casualty Insurance']
where is the time zone in florida?	['North American Eastern Time Zone']
what are all the songs nicki minaj is in?	"['Roman Reloaded', 'Monster', ""What's Wrong With Them (feat. Nicki Minaj)"", 'Dark Fantasy', 'YM Salute', 'Fire Burns', 'Letting Go (Dutty Love)', 'Woohoo (feat. Nicki Minaj)', 'Raining Men', 'Champion']"
what channel is anderson cooper talk show on?	['CNN']
what languages do people speak in egypt?	['Egyptian language', 'Akkadian language', 'Hittite language']
where is atlanta texas located?	['Cass County']
what is the official language of china and 3 other dialects?	['Standard Mandarin']
what timezone is texas san antonio in?	['Central Time Zone']
when did hurricane irene hit ct?	['2011 Atlantic hurricane season']
who is ellen albertini dow?	['Actor']
what sports do they have in china?	"['China PR national football team', ""China men's national volleyball team"", 'China national futsal team', 'China national baseball team', ""China women's national basketball team"", 'Bayi Yiyang High-Tech District', ""China women's national volleyball team"", 'China Fed Cup team', 'China national cricket team', 'China Davis Cup team']"
who played princess leia from star wars?	['Carrie Fisher']
what did baron de montesquieu die from?	['Fever']
who was audrey hepburn's husbands?	['Robert Wolders', 'Andrea Dotti', 'Mel Ferrer']
where was the battle of waterloo held?	['Waterloo']
who was ishmael's mom?	['Hagar']
who did scarlett johansson married?	['Ryan Reynolds']
what language do argentina use?	['Yiddish Language', 'Italian Language', 'Spanish Language']
which english team won the champions league first?	['the Federation of Free States']
when are the summer olympics held?	['Once every two years']
what currency do they use in qatar?	['Qatari riyal']
who invented the ford motor company?	['Henry Ford']
which ocean does the murray river flow into?	['Southern Ocean']
what did obama study in school?	['Political Science']
what kind of political system is canada?	['Parliamentary system', 'Federation', 'Constitutional monarchy', 'Multi-party system']
what did sir john frederick william herschel do?	['Cyanotype', 'Photographic fixer', 'Actinometer']
who is cameron crowe?	['Film Producer', 'Film Director', 'Writer', 'Screenwriter']
what currency do i need in egypt?	['Egyptian pound']
where does jason statham live?	['Sydenham', 'Great Yarmouth']
where was brad paisley born and raised?	['Glen Dale']
what team did doug williams play for?	['Washington Redskins', 'Tampa Bay Buccaneers', 'Arizona Outlaws', 'Grambling State Tigers football']
who plays miley cyrus brother?	['Guitarist']
what other discoveries did isaac newton discover?	['Reflecting telescope']
what clubs has peter crouch played for?	['Portsmouth F.C.', 'Queens Park Rangers F.C.', 'Liverpool F.C.', 'Tottenham Hotspur F.C.', 'Southampton F.C.', 'Aston Villa F.C.', 'Stoke City F.C.']
what currency is used in england 2012?	['UK £']
what did ronnie radke do?	['guitar', 'Lead vocalist', 'keyboard']
what does the roman empire consist of?	['Cilicia']
what was one of benjamin franklin's inventions?	['Franklin stove']
what language do the people speak in australia?	['Lojban', 'Esperanto Language', 'English Language']
what did charles lindbergh became famous for in the 1920s?	['Pilot']
what kind of money should i bring to dominican?	['Dominican peso']
which airport do ba fly to in oslo?	['Oslo Airport, Gardermoen', 'Oslo Airport, Fornebu']
when did sean murray first appear on ncis?	['2003']
where was emperor qin shi huang born?	['Handan']
when was the last superbowl win for the steelers?	['2006 NFL season']
when and where was william shakespeare buried?	['Church of the Holy Trinity, Stratford-upon-Avon']
what does julian clary do?	['Actor']
what kind of money is used in israel?	['Israeli new shekel']
what secondary school did adolf hitler go to?	['Realschule']
who nominated anthony kennedy?	['Ronald Reagan']
what political system does russia use?	['Constitutional republic']
what country did john cabot sail for?	['Italy']
what currency should i take to mauritius?	['Mauritian rupee']
when did mary shelley write frankenstein what were the circumstances?	"[""In 1817 they settled at Marlow-on-Thames and Mary turned Frankenstein into a novel, consulting Davy's chemistry lectures to give authenticity to her story about a scientist who creates life and then cannot control the creature he has made.""]"
what did doctor kevorkian do?	['Physician', 'Pathologist']
what type of government does nigeria have today?	['Presidential system', 'Federal republic', 'Federation']
what are fun things to do in philadelphia?	['Philadelphia Zoo', 'Wagner Free Institute of Science', 'African American Museum in Philadelphia', 'Liberty Bell', 'Rodin Museum', 'Independence Hall', 'Boathouse Row', 'Academy of Natural Sciences', 'Reading Terminal Market', 'Franklin Institute']
where did the cuban missile crisis happen?	['Cuba Island']
what did neil say on the moon?	['One Small Step']
what time do atlantic city bars close?	['World War I Memorial']
what type of government does mexico use?	['Federal government of Mexico']
where did jane mansfield die?	['Slidell']
what two countries is the us at war with?	['War in Afghanistan']
where did kirk herbstreit?	['College GameDay', 'College Football Final', 'ESPN College Football on ABC', 'Saturday Night Football', 'Battle of the Gridiron Stars', 'College Football Live']
what did einstein do?	['Theoretical Physicist']
when countries joined the european union?	['1/1/1995', '1/1/2007', '1/1/1973', '5/1/2004', '3/25/1957']
what currency is used in france before euro?	['French franc', 'Assignat']
what does michael jackson like to eat?	['Vegetarian food']
who plays jason gideon?	['Mandy Patinkin']
what did the german revolution lead to?	['German Democratic Republic']
what is the language called in russia?	['Russian Language']
where do the chicago cubs play?	['Wrigley Field']
where is the gobi desert located?	['Mongolia']
what are some famous tourist attractions in germany?	['Topography of Terror']
what type of government does the bahamas?	['Parliamentary system', 'Unitary state', 'Constitutional monarchy']
what country does spanish come from?	['Spain']
which country is gaza city located?	['Israel']
what countries did queen victoria reign over?	['United Kingdom']
what kind of money do the netherlands use?	['Euro']
what money is used in england?	['UK £']
who started southwest airlines?	['Herb Kelleher', 'Rollin King']
who plays giles in buffy the vampire slayer?	['Anthony Stewart Head']
who was the 2nd prime minister of pakistan?	['Muhammad Zia-ul-Haq']
what does the devil look like in young goodman brown?	['The Old Man']
where does jamie chung live?	['San Francisco']
what branch is made up of the house of representatives?	['Congress']
what does beth tweddle compete in?	['Artistic gymnastics']
what kind of music does john mayer play?	['Pop rock']
when did the chicago bulls win their first championship?	['1991 NBA Finals']
where was zachary taylor elected from?	['Kentucky']
where did william howard taft go to high school?	['Woodward High School']
what games did bungie make?	['Minotaur: The Labyrinths of Crete', 'Marathon Infinity', 'Marathon 2: Durandal', 'Operation Desert Storm', 'Myth II: Soulblighter', 'Abuse', 'Pathways into Darkness', 'Gnop!', 'Myth: The Fallen Lords', 'Marathon']
where did the name rome come from?	['Romulus and Remus']
what movies did jenna dewan play in?	['The Grudge 2', 'Step Up', 'Take the Lead', 'Balls to the Wall', 'Fab Five: The Texas Cheerleader Scandal', 'Waterborne', 'American Virgin', 'Love Lies Bleeding', 'Tamara', 'Slightly Single in L.A.']
which country is north of the usa?	['Canada']
what songs has madonna written?	"['Masterpiece', 'Die Another Day', ""I'll Remember"", ""Give Me All Your Luvin'"", 'Future Lovers', 'Future Lovers/I Feel Love', 'Like a Prayer', 'This Used to Be My Playground', 'Gang Bang', ""Who's That Girl""]"
what province is toronto canada located in?	['Ontario']
what do people from spain speak?	['Spanish Language']
what kind of money do you use in aruba?	['Aruban florin']
what stadium did the chicago cardinals play in?	['University of Phoenix Stadium']
what is the national anthem of russia?	['National Anthem of Russia']
what planet was luke skywalker raised on?	['Tatooine']
what is the time zone in oklahoma city?	['Central Time Zone']
who was the apostle paul considered to be?	['Paul of Tarsus']
what to see and do in revelstoke?	['Kinbasket Lake']
what to see and do in galway ireland?	"['Galway City Museum', 'Taibhdhearc na Gaillimhe', 'Spanish Arch', 'Cathedral of Our Lady Assumed into Heaven and St Nicholas, Galway', 'Galway Sportsgrounds', 'Hotel Meyrick', 'Eyre Square', ""St. Nicholas' Collegiate Church"", 'National University of Ireland, Galway', 'Galway Arts Festival']"
when was the 2012 calgary stampede?	['1988 Winter Olympics']
when was the last time the oakland raiders won the super bowl?	['Super Bowl XV']
what school did joan miro attend?	['Cercle Artístic de Sant Lluc']
what did bob ross die of?	['Lymphoma']
what influenced vincent van gogh work?	['Jozef Israëls', 'Paul Cézanne', 'Anton Mauve', 'Peter Paul Rubens', 'Jean-François Millet', 'Willem Roelofs', 'Eugène Delacroix', 'Claude Monet', 'Rembrandt']
what language do the people in ghana speak?	['English Language']
what continent is greenland apart of?	['North America']
what is colorado's state flower?	['Aquilegia saximontana']
what division is cincinnati bengals in?	['AFC North']
where did boston terriers come from?	['United States of America']
what is molly ringwald in?	"['Office Killer', 'The Breakfast Club', 'Sixteen Candles', 'Fresh Horses', 'Strike It Rich', ""Betsy's Wedding"", 'Pretty in Pink', 'Spacehunter: Adventures in the Forbidden Zone', 'The Stand', 'Tempest']"
what are the kennedys?	['Rose Fitzgerald Kennedy', 'Patrick Bouvier Kennedy', 'John F. Kennedy', 'Rosemary Kennedy', 'Caroline Kennedy', 'Kathleen Cavendish', 'John F. Kennedy, Jr.', 'Joseph P. Kennedy, Sr.', 'Bobby Shriver', 'Joseph P. Kennedy, Jr.']
what does the maine state flag look like?	['Flag of Maine']
who does jr smith play for 2012?	['New York Knicks']
what do they call football in spanish?	['XHVG-FM']
