what is the state flower of pennsylvania?	['Kalmia latifolia']
where was tommy emmanuel born?	['Muswellbrook']
where did bernie madoff work?	['Bernard L. Madoff Investment Securities']
who was king or queen after james i?	['Charles I of England']
who plays effy in skins uk?	['Kaya Scodelario']
what is the best neighborhood to live in dallas?	['Convention Center District', 'City Center District', 'Government District', 'Arts District', 'West End', 'Belmont', 'Main Street', 'Farmers Market', 'Reunion', 'Bryan Place']
what is latin america spanish?	['Western Hemisphere']
what is there to do in niagara falls new york?	['Johann Williams Farm', 'Niagara Reservation', 'Adams Power Plant Transformer House', 'Fallsville Splash Park', 'Niagara Falls Public Library', 'Holley-Rankine House', 'Whitney Mansion', 'US Post Office-Niagara Falls Main', 'U.S. Customhouse', 'Niagara Falls State Park']
what is considered eastern canada?	['Newfoundland']
what gunfight is wyatt earp most famous for?	['Gunfight at the O.K. Corral']
what is the official currency in france?	['CFP franc', 'Euro']
what countries are located in the netherlands?	['Kingdom of the Netherlands']
what do hungarian people speak?	['Hungarian']
what films have taylor lautner been in?	"['New Moon', ""He's a Bully, Charlie Brown"", 'Eclipse', 'Cheaper by the Dozen 2', 'Incarceron', 'The Adventures of Sharkboy and Lavagirl', 'Dear Eleanor', 'Abduction', 'Shadow Fury', 'Field of Dreams 2: Lockout']"
what is the time zone in france?	['Central European Time', 'UTC+01:00']
when did jennifer lopez start on in living color?	['In Living Color (Season 4)']
what language they speak in taiwan?	['Standard Mandarin']
where can i register to vote in urbana il?	['Champaign County']
when was blessed kateri born?	['1656']
what county is sacramento located in?	['Sacramento County']
who are betty white's parents?	['Tess Curtis Cachikis', 'Horace Lawrence White']
what is the money of argentina called?	['Argentine peso']
where did pres obama go to high school?	['Punahou School']
where did hammurabi come from?	['Babylonia', 'Babylon']
where's wayne state?	['Michigan', 'United States of America', 'Detroit']
what is the official language in mexico?	['Spanish Language']
what did gerald ford die of?	['Cardiovascular disease']
what is the atlanta braves mascot?	['Homer']
what team did grover cleveland alexander play for?	['Philadelphia Phillies', 'Chicago Cubs']
where did andreas vesalius die?	['Zakynthos']
what does russian people speak?	['Yiddish Language', 'Chuvash Language', 'Russian Language', 'Tatar Language', 'Ukrainian Language']
who did jon gosselin cheat with?	['Deanna Hummel']
where was selena gomez really born?	['Grand Prairie']
what did theodore roosevelt do that brought him to national prominence?	['President of the United States']
what are fun things to do in denver colorado?	['Black American West Museum & Heritage Center', 'Denver Firefighters Museum', 'Colorado State Capitol', 'Denver Mint', 'Molly Brown House', 'Forney Transportation Museum', 'Denver Botanic Gardens', 'Museum of Contemporary Art Denver', 'Denver Museum of Nature and Science', 'Chamberlin Observatory']
what currency does thailand use?	['Thai baht']
who is gilbert gottfried snl?	['Actor']
who plays marvin eriksen?	['Jason Segel']
what money is used in ukraine?	['Ukrainian hryvnia']
where to live near seattle wa?	['Magnolia']
who is paul revere and what did he do?	['Silversmith']
what type of business is mitt romney in?	['Politician']
what does guyana speak?	['English Language']
what kourtney kardashian name her daughter?	['Penelope Scotland Disick']
who was darth vader in episode 3?	['Hayden Christensen']
what is daniel radcliffe name in the woman in black?	['Arthur Kipps']
who is playing hawkeye in the avengers movie?	['Jeremy Renner']
who is the leader of cuba 2012?	['Raúl Castro']
what to do in panama city beach fl?	['Thunder Beach Motorcycle Rally', 'Club La Vela', 'Man in the Sea Museum', 'Camp Helen State Park', 'Pier Park', 'Shipwreck Island', 'Latimer Cabin', 'St. Andrews State Park', 'Miracle Strip at Pier Park']
what 4 teams did wayne gretzky play for?	['Edmonton Oilers']
what team does reggie bush play for 2011?	['Miami Dolphins']
what job does bill rancic have?	['Entrepreneur', 'Businessperson', 'Writer', 'Television Producer', 'Author']
what movies star adam sandler?	['Funny People', 'Anger Management', 'Happy Gilmore', 'Big Daddy', '50 First Dates', 'Click', 'Bulletproof', 'Billy Madison', 'Eight Crazy Nights', 'Airheads']
what was jack london's education?	['University of California, Berkeley', 'Oakland High School']
what is paige halliwell's powers?	['Teleportation', 'Orbing']
what musical instruments did duke ellington play?	['Piano', 'Jazz piano']
who was michael jackson in the wiz?	['Scarecrow']
where was the earthquake in chile 2010?	['Maule Region']
what does jamaica manufacturer?	['Desnoes & Geddes Dragon Stout', 'Red Stripe', 'Desnoes & Geddes Red Stripe Lager']
what is the rainforest in south america called?	['Amazon Basin']
where did queen isabella live?	['Madrigal de las Altas Torres']
who was charles darwin married to?	['Emma Darwin']
what party did john tyler belong to?	['Democratic Party', 'Independent', 'Whig Party']
what are all songs by taylor swift?	['Cold as You', 'Love Story Oooh Baby Just Say Yes', 'Beautiful Eyes', 'A Place in This World', 'Love Story (U.S. Pop mix)', 'I Heart?', 'White Horse', 'Picture to Burn (radio edit)', 'Christmases When You Were Mine', 'Love Story (Stripped)']
where did dr martin luther king get his doctorate?	['Boston University']
what is the official state flower of arizona?	['Saguaro']
where does the philadelphia union soccer team play?	['PPL Park']
what do michelle obama do for a living?	['Writer', 'Lawyer']
who were queen elizabeth 1 parents?	['Anne Boleyn', 'Henry VIII of England']
what year was peyton manning's rookie year?	['1998 NFL Draft']
what kind of guitar does lindsey buckingham play?	['Bass guitar']
what timezone are the bahamas?	['UTC-5', 'North American Eastern Time Zone']
when did joe mcelderry won x factor?	['The X Factor (UK) - Season 6']
what is the capital city of canada on a map?	['Ottawa']
where did thomas jefferson died?	['Charlottesville']
what made angela davis famous?	['Political activist']
what jobs did harriet tubman have?	['Writer']
who is the house of representatives made up of?	['Nancy Pelosi']
where was ted kennedy buried?	['Arlington National Cemetery']
what timezone is reno nv?	['Pacific Time Zone']
who does michael vick play for?	['Philadelphia Eagles']
who does jamie campbell bower play in breaking dawn?	['Anne Elizabeth Roseberry']
where was the battle of vicksburg located?	['Warren County']
who did george wendt play on cheers?	['Norm Peterson']
what year did mcfly go to the future?	['6th March 2006']
where is st louis cardinals stadium?	['Busch Stadium']
what is the name of justin bieber brother?	['Jazmyn Bieber', 'Jaxon Bieber']
who is ruling tunisia now?	['Ali Laarayedh']
what country is next to russia?	['Ukraine', 'Belarus', 'Kazakhstan', 'Poland', 'Lithuania', 'Azerbaijan', 'Mongolia', 'North Korea', 'Georgia', 'Norway']
what countries does japan export to?	['Canada', 'Sudan', 'Tanzania', 'United States of America', 'Kiribati', 'New Zealand']
what is d capital city of south africa?	['Bloemfontein', 'Pretoria', 'Cape Town']
when did toronto blue jays become a team?	['1977 Major League Baseball Season']
which country has adopted the euro as its currency ( 1 point )?	['Italy', 'Portugal', 'Finland', 'Luxembourg', 'France', 'Slovenia', 'Austria', 'Germany', 'Greece', 'Spain']
what kind of language does switzerland speak?	['Romansh language', 'French Language', 'German Language', 'Italian Language']
what are fun things to do in seattle wa?	['Woodland Park Zoo', 'Henry Art Gallery', 'Seattle Art Museum', 'Seattle Aquarium', 'Frye Art Museum', 'Space Needle', 'Pike Place Market', 'Smith Tower', 'Tillicum Village', 'Museum of Flight']
what university did donald trump graduate from?	['The Kew-Forest School', 'University of Pennsylvania', 'Fordham University', 'Wharton School of the University of Pennsylvania', 'New York Military Academy']
who controls panama?	['Ricardo Martinelli']
which team does ronaldinho play for 2013?	['Brazil national football team']
what college did tosh . o go to?	['University of Central Florida']
where is greyton western cape?	['Western Cape']
where are facebook headquarters located?	['California']
what years did brett favre go to the super bowl?	['1995 NFL season', '1996 NFL season', '1997 NFL season']
who plays sarah wittle in jumanji?	['Bonnie Hunt']
what county is stockton ca located in?	['San Joaquin County']
where did rihanna grow up?	['Saint Michael Parish', 'Barbados']
what kind of books does nicholas sparks wrote?	['Das Lächeln der Sterne.', 'Weg Der Traume', 'Three weeks with my brother', 'Dear John', 'A bend in the road', 'Weg der Träume.', 'Une bouteille à la mer', 'A Tout Jamais', 'At first sight', 'The Choice']
who plays kenneth on 30 rock?	['Jack McBrayer']
what did thoreau die from?	['Tuberculosis']
who was louis riel?	['Politician']
where did the roma people come from?	['Romani people']
what are the duggars kids names and ages?	['Jana Duggar']
where is mallorca?	['Mediterranean Sea']
where tupac grew up?	['East Harlem']
who is the new governor of oregon?	['John Kitzhaber']
what good things has angelina jolie done?	['Academy Award for Actress in a Supporting Role']
who was the governor of missouri in 1996?	['Mel Carnahan']
where are the florida marlins from?	['Sun Life Stadium', 'Marlins Park']
when does canada's wonderland close?	['Émilie Heymans', 'Blythe Hartley']
what country do they speak farsi?	['Canada', 'Afghanistan', 'Iran', 'Oman', 'Uzbekistan', 'Bahrain', 'Iraq', 'Tajikistan']
who taught michelangelo to sculpt?	"[""Lorenzo de' Medici"", 'Domenico Ghirlandaio', 'Giovanni Pico della Mirandola', 'Girolamo Savonarola', 'Melozzo da Forlì']"
where did nadia boulanger live?	['Paris']
what county is clearwater fl in?	['Pinellas County']
what language do people speak in iran?	['Persian']
what type of art is henri matisse famous for?	['Sculpture', 'Printmaking', 'Collage', 'Painting', 'Drawing']
who played john connor friend in terminator 2?	['Edward Furlong']
what kind of voting system does japan have?	['Parliamentary system', 'Unitary state', 'Constitutional monarchy']
who killed harvey milk?	['Dan White']
where the murray river located?	['Australia']
where do you fly into for destin?	['Northwest Florida Regional Airport', 'Destin–Fort Walton Beach Airport']
who plays lois griffin in family guy?	['Alex Borstein']
who is the falcons quarterback 2012?	['Matt Ryan']
who owns the new england patriots football team?	['Robert Kraft']
what year did giants win world series?	['2010 World Series', '2012 World Series']
what style of music did louis armstrong play?	['Jazz']
where is lanzarote in a world map?	['Canary Islands']
when is wimbledon tennis tournament?	['Yearly']
where is luke bryan from?	['Leesburg']
what movies have adam sandler been in?	"['Big Daddy', 'Dickie Roberts: Former Child Star', 'Joe Dirt 2', 'Bedtime Stories', 'Click', 'The Benchwarmers', 'Eight Crazy Nights', 'The House Bunny', ""You Don't Mess with the Zohan"", 'I Now Pronounce You Chuck and Larry']"
what university did bill clinton graduated from?	['Yale Law School']
what country is vatican city in?	['Rome']
what a city in montana?	['Helena']
what is language in argentina?	['Yiddish Language', 'Italian Language', 'Spanish Language']
where did kobe bryant attend high school?	['Lower Merion High School']
who is the present chief justice of the u.s. supreme court?	['John Roberts']
who was gregor mendel and what did he contribute to science?	['Mendelian inheritance']
what did whitney houston die off?	['Drowning', 'Coronary artery disease', 'Cocaine overdose']
what is the money currency in italy?	['Euro']
where did martin luther live in?	['Saxony-Anhalt']
what high school did tim allen go to?	['Seaholm High School']
which party did lincoln belong to?	['Illinois Republican Party', 'Republican Party', 'National Union Party', 'Whig Party']
what movies have queen latifah played in?	['Taxi', 'Jungle Fever', 'Set It Off', 'Stranger than Fiction', 'Last Holiday', 'Brown Sugar', 'Ice Age: The Meltdown', 'Ice Age: Dawn of the Dinosaurs', 'Hairspray', 'Bringing Down the House']
where did kurds originate from?	['Asia']
where did lebron james go to highschool?	['St. Vincent – St. Mary High School']
what college did matt schaub play for?	['Virginia Cavaliers football']
what inspired van gogh work?	['Jozef Israëls', 'Paul Cézanne', 'Anton Mauve', 'Peter Paul Rubens', 'Jean-François Millet', 'Willem Roelofs', 'Eugène Delacroix', 'Claude Monet', 'Rembrandt']
what inspired m.c. escher to become an artist?	['Giovanni Battista Piranesi']
what was the purpose of the 1964 gulf of tonkin resolution?	['Yen Bai mutiny']
what kind of government iran have?	['Islamic republic', 'Theocracy', 'Unitary state']
what did joseph lister do for science?	['Listerine']
what state in chicago in?	['Illinois']
what is mount st helens?	['Stratovolcano', 'Volcano']
where is the bank of america pavilion?	['Suffolk County']
what magazine did edgar allan poe work for?	"['The Stylus', ""Graham's Magazine"", 'Broadway Journal', ""Burton's Magazine""]"
where did pixie lott go to school?	['Italia Conti Academy of Theatre Arts']
what currency can you use in aruba?	['Aruban florin']
where did dr seuss go to school?	['Dartmouth College', 'University of Oxford', 'Lincoln College, Oxford']
where was the vietnam war located?	['Vietnam']
what did cam newton do?	['Quarterback']
when did maria sharapova start playing tennis?	['2004 Wimbledon Championships']
what money system does australia use?	['Australian dollar']
who does david james play for 2011?	['Bristol City F.C.']
what team does diego forlan currently play for?	['Sport Club Internacional']
what county is orlando fl in?	['Orange County']
what does scottish people speak?	['English Language']
what to do and see in miami florida?	['Wolfsonian-FIU', 'Lowe Art Museum', 'Holocaust Memorial of the Greater Miami Jewish Federation', 'Miami Art Museum', 'Frost Art Museum', 'Coral Castle', 'Jewish Museum of Florida', 'Jungle Island', 'Miami Seaquarium', 'Venetian Pool']
who is the current president of colombia 2011?	['Juan Manuel Santos']
who did bryce dallas howard play in eclipse?	['Victoria']
what kind of money does argentina use?	['Argentine peso']
where did charlton heston live?	['St. Helen', 'Wilmette', 'Los Angeles', 'Evanston']
who owns chrysler corporation 2012?	['Walter Chrysler']
where did darfur happen?	['Sudan']
what books did emily dickinson wrote?	"['Two poems', 'Hope is the thing with feathers', 'Success', 'The letters', 'Selected poetry of Emily Dickinson', ""Emily Dickinson's open folios"", 'Poems', 'Acts of Light: The World of Emily Dickinson', 'The complete poems', 'Emily Dickinson']"
who voices ray in archer?	['Adam Reed']
what is the second percy jackson book called?	['The Sea of Monsters']
what movies did ron howard do?	['Apollo 13', 'A Beautiful Mind', 'Curious George', 'Happy Days', 'Cocoon', 'From the Earth to the Moon']
what made roald dahl famous?	['Novelist']
what is charlotte north carolina known for?	"[""Bojangles' Coliseum"", 'U.S. National Whitewater Center', 'Land of Oz', 'Discovery Place', 'NASCAR Hall of Fame', 'Carolinas Aviation Museum', 'Billy Graham Library', 'Bechtler Museum of Modern Art', 'Freedom Park', 'North Carolina Performing Arts Center at Charlotte Foundation']"
who played lt uhura?	['Nichelle Nichols']
what did camille grammer do for a living?	['Film Producer', 'Model', 'Actor']
where are the ruins of pompeii?	['Pompeii and the Roman Villa: Art and Culture around the Bay of Naples']
what disease michael jackson?	['Mysophobia']
what did the new orleans hornets used to be?	['Charlotte Hornets']
what other languages does switzerland speak?	['Romansh language', 'French Language', 'German Language', 'Italian Language']
what language do they speak thailand?	['Mon Language', 'Lao Language', 'Khmer language', 'Hmong language', 'Thai Language', 'Cham language', 'Mlabri language', 'Malay, Pattani Language', 'Nyaw Language', 'Saek language']
where did robbie hummel go to high school?	['Valparaiso High School']
what currency do mexico use?	['Mexican peso']
what is the current time in nigeria lagos?	['Central European Time']
who won the governor election in michigan?	['Rick Snyder']
what can you do in palm springs ca?	"['The Fabulous Palm Springs Follies', 'Palm Springs Air Museum', 'Living Desert Zoo and Gardens', 'Palm Springs Walk of Stars', 'The Palm Springs Art Museum', ""Knott's Soak City"", 'Tahquitz Canyon', 'Palm Springs Aerial Tramway', 'Moorten Botanical Garden and Cactarium', 'San Jacinto Mountains']"
where is wellsville missouri?	['United States of America', 'Montgomery County', 'Missouri']
what currency do i bring to cuba?	['Cuban peso']
in what city did machiavelli live?	['Florence']
what is martin cooper doing now?	['Inventor']
what company did verizon used to be?	['AT&T Corporation']
where donald trump went to college?	['The Kew-Forest School', 'University of Pennsylvania', 'Fordham University', 'Wharton School of the University of Pennsylvania', 'New York Military Academy']
who does the voice of kovu in lion king?	['Jason Marsden']
where is amazon based out of?	['Seattle']
where do the broncos play?	['Sports Authority Field at Mile High']
who has been married to julia roberts?	['Daniel Moder', 'Lyle Lovett']
what is the major language of jamaica?	['Jamaican English']
what book did w.e.b. dubois wrote?	['Writings', 'The Souls of Black Folk', 'John Brown', 'The Negro', 'W.E.B. Du Bois on Asia', 'Darkwater', 'The world of W.E.B. Du Bois', 'The illustrated Souls of Black folk', 'The suppression of the African slave trade to the United States of America, 1638-1870', 'Dark princess']
who is the coach of the la lakers?	"[""Mike D'Antoni""]"
where is thomas jefferson's home?	['Monticello']
who is country singer jewel married to?	['Ty Murray']
where did pavlova originate?	['New Zealand cuisine']
what is currency in panama?	['United States dollar', 'Panamanian balboa']
where is arabic the official language?	['Bahrain', 'Saudi Arabia', 'Libya', 'Algeria', 'Egypt', 'Kuwait', 'Lebanon', 'Israel', 'Jordan', 'Iraq']
where are the libyan refugees going?	['Tunisia']
what battle did germany surrender in ww2?	['Berlin']
what county is rihanna from?	['Saint Michael Parish', 'Barbados']
where is the nascar hall of fame?	['Charlotte', 'North Carolina']
in what year did columbus sail to the new world?	['1492 Conquest of Paradise']
what is the san francisco giants mascot?	['Crazy Crab', 'Lou Seal']
what did whitney houston die of?	['Drowning', 'Coronary artery disease', 'Cocaine overdose']
what technique did vincent van gogh use in his paintings?	['Post-Impressionism']
what was karl marx beliefs?	['Marxism']
what is the bosnian language?	['Serbo-Croatian', 'Croatian language', 'Bosnian language', 'Serbian language']
where did robin gibb die?	['London']
who played dorothy in the film wizard of oz?	['Aileen Quinn', 'Morgan Hallet', 'Lea Michele', 'Diana Ross', 'Sumi Shimamoto', 'Jill Small', 'Romola Remus', 'Fairuza Balk', 'Bebe Daniels', 'Judy Garland']
when is the last time chicago bulls won a championship?	['1992 NBA Finals', '1991 NBA Finals', '1997 NBA Finals', '1993 NBA Finals', '1998 NBA Finals', '1996 NBA Finals']
where is martin cooper from?	['United States of America']
what is st mary mascot?	['Griffin']
what did julian fellowes write?	['Never Mind the Full Stops', 'Julian Fellowes Investigates: A Most Mysterious Murder', 'My Son, My Son', 'Sharpe', 'Monarch of the Glen', 'Our Friends in the North']
what is the zip code for moorpark ca?	['93021', '93020']
what contribution did maurice wilkins make to dna?	['Albert Lasker Award for Basic Medical Research']
when is the last time the chicago bulls won a championship?	['1998 NBA Finals']
what is there to see in barcelona?	"['Museu Picasso', 'Gothic Quarter, Barcelona', 'Park Güell', 'La Rambla', 'Palau de la Música Catalana', 'Sagrada Família', ""Plaça d'Espanya, Barcelona"", 'Barcelona Museum of Contemporary Art', 'Casa Milà', ""Museu Nacional d'Art de Catalunya""]"
what countries in north america continent?	['Navassa Island', 'Greenland', 'Honduras', 'El Salvador', 'Saint Pierre and Miquelon', 'Jan Mayen', 'Guatemala', 'Aruba', 'Clipperton Island', 'Belize']
what language does people in netherlands speak?	['Frisian languages', 'West Flemish', 'Dutch Language']
what kind of money does chile use?	['Chilean peso']
what is the last movie brittany murphy made?	['8 Mile']
what type of music did vivaldi write?	['Classical music']
what book did charles darwin write on evolution?	['On evolution']
what did the habsburg family control?	['Kingdom of Hungary', 'Kingdom of Bohemia', 'Holy Roman Empire', 'Kingdom of Ireland', 'Kingdom of Portugal', 'Slovenia', 'Austria', 'Croatia', 'German Empire', 'Kingdom of England']
what's the book hitler wrote in prison?	['Mein Kampf']
what does latin america consist of?	['Bolivia', 'Honduras', 'Cuba', 'El Salvador', 'Guatemala', 'Costa Rica', 'Cuauhtémoc, D.F.', 'Great Pyramid of Tenochtitlán', 'Paraguay', 'Belize']
who is lamar odom married too?	['Khloé Kardashian']
when did tom brady join the patriots?	['2001 NFL season']
who was jacob riis and why was he important?	['Photographer', 'Journalist', 'Artist']
what years did yankees win championships?	['1941 World Series', '1939 World Series', '1932 World Series', '1928 World Series', '1936 World Series', '1923 World Series', '1927 World Series', '1937 World Series', '1938 World Series', '1943 World Series']
where did jfk and his wife live?	['Boston', 'Massachusetts', 'Washington, D.C.']
what does australia export?	['Energy', 'Agriculture']
what college did joakim noah attend?	['University of Florida']
where does peter king live?	['New York City']
where did pablo picasso die?	['Mougins']
what money do they use in thailand?	['Thai baht']
what are five countries that border france?	['Italy', 'Monaco', 'Luxembourg', 'Andorra', 'Switzerland', 'Germany', 'Bay of Biscay', 'Belgium', 'Piedmont', 'Spain']
who does new zealand import from?	['China']
where does the st louis rams play football?	['Edward Jones Dome']
where is john deere made?	['Moline']
what bible do rastafarians use?	['Zion', 'Afrocentrism', 'Jah']
with which countries does south africa trade?	['Tanzania', 'Angola']
what is st francis patron saint of?	['All Creatures Of Our God And King']
where did saki live?	['United Kingdom']
where was the battle of vicksburg held?	['Warren County']
who played wesley crusher on star trek the next generation?	['Wil Wheaton']
what type of government did sparta greece have?	['Monarchy', 'Diarchy']
who killed vincent chin dvd?	['Ronald Ebens', 'Michael Nitz']
what movies does matt damon play in?	['American Teacher', 'Contagion', 'Che: Part Two', 'All the Pretty Horses', 'Courage Under Fire', 'Dogma', 'Behind the Screens', 'Confessions of a Dangerous Mind', 'Elysium', 'Chasing Amy']
who was timothy mcveigh accomplice?	['Terry Nichols']
who did juan ponce de leon married?	['Leonor de León']
what type of currency does the us have?	['United States dollar']
what is the capital of kentucky known for its bluegrass?	['Frankfort']
where is jack daniel buried?	['Lynchburg']
what two countries speak italian?	['Italy']
what did jimmy valvano die with?	['Cancer']
who was irving berlin and what did he do?	['Songwriter', 'Lyricist', 'Composer']
what war did george washington help win?	['American Revolutionary War']
who plays mary jane in spiderman 2?	['Kirsten Dunst']
where did richard nixon go to high school?	['Fullerton Union High School']
what currency is used in hungary?	['Hungarian forint']
where did kurt cobain die?	['Seattle']
who did mario lopez just marry?	['Courtney Laine Mazza']
who did john fox coach for?	['Denver Broncos']
what is time zone in new orleans?	['Central Time Zone']
what type of currency does brazil use?	['Brazilian real']
where is rome italy located on a map?	['Rome']
what things did thomas edison invent?	['Phonograph', 'Carbon microphone', 'Mimeograph', 'Quadruplex telegraph', 'Electric power distribution', 'Movie camera', 'Incandescent light bulb', 'Phonograph cylinder']
what music did beethoven composed?	['Opera', 'Classical music']
what is the zip code of new york city?	['10004', '10005', '10006', '10007', '10001', '10002', '10003', '10009', '10013', '10012']
what is julia gillard famous for?	['Prime minister']
what kind of drugs does charlie sheen do?	['Cocaine']
what will happen to greece when it defaults?	['European Union']
where was avril lavigne born?	['Belleville']
who are the judges on the us supreme court?	['John Roberts', 'Clarence Thomas', 'David Souter', 'John Paul Stevens', 'Edward Douglass White']
which legend of zelda game is the first?	['The Legend of Zelda']
what country was osama bin laden killed in?	['Abbottabad']
who shot and killed president john f kennedy?	['Lee Harvey Oswald']
who is abraham maslow?	['Psychologist']
where do islamic people go to worship?	['Mosque']
what kind of system of government does the united states have?	['Presidential system', 'Federal republic', 'Representative democracy', 'Two-party system', 'Constitutional republic', 'Republic']
who did mike tomlin play for?	['Pittsburgh Steelers']
who coached the dallas cowboys in 1996?	['Jimmy Johnson']
who won the fa cup in 2008?	['Portsmouth F.C.']
who all has jason kidd played for?	['New York Knicks', 'Phoenix Suns', 'Brooklyn Nets', 'Dallas Mavericks']
what movies have gerard butler been in?	['Attila', 'Beowulf & Grendel', '300', 'Dear Frankie', 'Butterfly on a Wheel', 'Gamer', 'Fast Food', 'Dracula 2000', 'Coriolanus']
what team does hank baskett play for 2011 season?	['Indianapolis Colts']
who did alf's voice?	['Paul Fusco']
