what songs did whitney houston?	"['Count on Me', ""Ain't No Way (feat. Mary J. Blige)"", 'Why Does It Hurt So Bad', 'I Will Always Love You', ""I'm Every Woman"", 'Who Would Imagine a King', ""You'll Never Stand Alone"", 'My Love Is Your Love', 'Fine', ""It's Not Right, but It's Okay""]"
what all countries are in south america?	['Carrasco', 'Chacaltaya', 'Chile', 'Pampas', 'Amazon Basin', 'French Guiana', 'Peru', 'Guyana', 'Paraguay', 'Bolivia']
where is ellis park rugby stadium?	['New York City']
who played lex luthor in the original superman?	['Gene Hackman']
what is the economy of china?	['Socialist state']
where is poe buried now?	['Westminster Hall and Burying Ground']
where do the houston rockets play basketball?	['Toyota Center']
what team does drogba play for 2013?	['Galatasaray S.K.']
where is the country of cyprus located?	['Europe', 'Mediterranean Sea', 'Cyprus', 'Asia', 'Eurasia']
what did hans oersted discovered in 1819?	['Aluminium']
who played eowyn in the lord of the rings movies?	['Miranda Otto']
what date did the earthquake in christchurch happen?	['2011 Christchurch earthquake']
what was jesse james wife name?	['Zerelda Mimms']
who do derek fisher play for?	['Los Angeles Lakers']
which country is to the north of the united states of america?	['Canada']
in what timezone is arizona?	['Mountain Time Zone', 'UTC−07:00']
where did the casey anthony case take place?	['Orlando']
what timezone is denver co?	['Mountain Time Zone', 'UTC−07:00']
what country is beside france?	['Italy', 'Monaco', 'Luxembourg', 'Andorra', 'Switzerland', 'Germany', 'Bay of Biscay', 'Belgium', 'Piedmont', 'Spain']
where is colombia the country?	['South America', 'Americas']
who plays tommy oliver in power rangers?	['Jason David Frank']
who is carl edwards racing for?	['Roush Fenway Racing']
what instruments did vivaldi wrote concertos for?	['Violin']
who was the first russian president?	['Dmitry Medvedev']
when did herbert hoover become president?	['3/4/1929']
what was samuel de champlain searching for?	"[""Champlain's Dream: The European Founding of North America""]"
where did madoff live?	['Palm Beach', 'France', 'Roslyn', 'Montauk', 'Manhattan', 'Queens']
what countries does the niger river flow through?	['Libya', 'Chad', 'Algeria', 'Mali', 'Nigeria', 'Burkina Faso', 'Benin']
when did the new york knicks win a championship?	['1970 NBA Finals', '1973 NBA Finals']
what county is plymouth ia in?	['Cerro Gordo County']
what state is rick santorum from?	['Pennsylvania']
what color are the arizona cardinals uniforms?	['Black', 'White', 'Cardinal']
what season did brooke burke won?	['Dancing with the Stars - Season 7']
who are senators from utah?	['Orrin Hatch', 'Mike Lee', 'Bob Bennett']
what timezone is nevada in right now?	['Mountain Time Zone', 'UTC−07:00', 'Pacific Time Zone', 'UTC-8']
what is the political system in egypt?	['Semi-presidential system', 'Constitutional republic', 'Republic', 'Unitary state']
where did st louis tornado hit?	['St. Louis']
what does china border?	['Eurasia', 'Asia']
what was one thing benjamin franklin is famous for?	['Bifocals']
what kind of money do japanese use?	['Japanese yen']
who was leonardo da vinci teacher?	"[""lorenzo de' medici patron of leonardo da vinci""]"
what language do irish people speak?	['English Language']
what is a city in belgium?	['City of Brussels']
where to travel in africa in january?	['Angola', 'Côte d’Ivoire', 'Central African Republic', 'Burkina Faso', 'Djibouti', 'Congo', 'Burundi', 'Botswana', 'Cape Verde', 'Benin']
who was judy garland married to?	['Mark Herron', 'Sidney Luft', 'David Rose', 'Mickey Deans', 'Vincente Minnelli']
where is the country of armenia?	['Turkey', 'Georgia', 'Azerbaijan']
who wrote the book of st. john?	['John the Evangelist']
what going on in afghanistan right now?	['Conflict in Afghanistan']
where to vacation in italy in august?	"['Corriere della Sera', ""l'Unità"", 'Il Foglio', 'la Repubblica', 'Il Messaggero', 'La Domenica del Corriere', 'La Stampa', 'Avanti!', 'La Gazzetta dello Sport', 'Liberazione']"
what movies has renee zellweger been in?	"[""Bridget Jones's Diary""]"
what party was lincoln affiliated with?	['Illinois Republican Party', 'Republican Party', 'National Union Party', 'Whig Party']
what did ryan dunn died from?	['Traffic collision']
where is made kia car?	['Seoul']
where english is spoken in the world?	['Canada', 'Australia', 'South Africa', 'Zambia', 'United Kingdom', 'Zimbabwe', 'Uganda', 'New Zealand', 'Turks and Caicos Islands', 'Tanzania']
who plays ferris bueller's best friend?	['Alan Ruck']
what are two countries in south america?	['Carrasco', 'Chacaltaya', 'Chile', 'Pampas', 'Amazon Basin', 'French Guiana', 'Peru', 'Guyana', 'Paraguay', 'Bolivia']
who played elle greenaway?	['Lola Glaudini']
who is ruling north korea now?	['Kim Jong-un']
what state did roger sherman represent at the constitutional convention?	['Connecticut']
what did sammy davis jr die of?	['Complication', 'Throat cancer']
what is the national flag of russia?	['Flag of Russia']
who did marco polo travel with?	['Niccolò Polo', 'Nicole Anna Defuseh']
where did charles drew go to high school?	['Dunbar High School']
who was the real erin brockovich?	['Environmentalist', 'Paralegal']
who are the current maryland senators?	['Ben Cardin']
when is the new series of the only way is essex starting?	['West Horndon']
what language do u speak in egypt?	['Modern Standard Arabic']
what did kourtney kardashian go to college for?	['Theatre']
when and where did the battle of antietam take place?	['Sharpsburg']
where is tahiti bora bora?	['French Polynesia']
what is the short name for stephanie?	['Stepha']
who is the actor that plays rico in hannah montana?	['Moisés Arias']
where did elvis presley started his career?	['Memphis']
what time zone is the uk in right now?	['Greenwich Mean Time', 'UTC±00:00']
where in oregon was stand by me filmed?	['Mahonia aquifolium', 'Oregon Swallowtail', 'Western Meadowlark', 'Alis volat propriis', 'Pseudotsuga', 'Chinook salmon', 'Milk']
what language do they speak brazil?	['Brazilian Portuguese', 'Portuguese Language', 'Italian Language']
what should i do today in houston?	['George R. Brown Convention Center', 'Sam Houston Race Park', 'Rothko Chapel', 'Kemah Boardwalk', 'Space Center Houston', 'Downtown Aquarium, Houston', 'Hanna–Barbera Land', 'Bayou Bend', 'SplashTown Houston', 'Houston Zoo']
where did chickasaw indians live?	['Indigenous peoples of the Southeastern Woodlands']
which country did james cook sailed for?	['Kingdom of Great Britain']
what type of guitar does kirk hammett play?	['guitar', 'Sitar', 'Bass guitar']
what club did santi cazorla play for?	['Spain national football team']
what language brazil use?	['Portuguese Language']
what features do islam and christianity have in common?	['Abrahamic religions']
who did warren moon play for?	['Seattle Seahawks', 'Washington Huskies football', 'Houston Oilers', 'Minnesota Vikings', 'Kansas City Chiefs']
what is the state motto of massachusetts?	['Ense petit placidam sub libertate quietem']
where is el salvador located?	['Americas']
where was president chester arthur born?	['Fairfield']
what are major religions in the united states?	['Unitarian Universalism', 'Judaism', 'Christianity', 'Atheism', 'Buddhism', 'Hinduism', 'Islam']
where was ronald reagan born and raised?	['Tampico']
what is janelle monae famous for?	['Singer', 'Artist']
who raised queen victoria?	['Prince Edward, Duke of Kent and Strathearn', 'Princess Victoria of Saxe-Coburg-Saalfeld']
where does selena gomez live map?	['New York City']
when were the phillies founded?	['1883']
what time zone is new york under?	['North American Eastern Time Zone']
what did kenny everett die off?	['AIDS']
what is the jurisdiction of the us supreme court?	['United States of America']
what do italy people eat for breakfast?	"['Corriere della Sera', ""l'Unità"", 'Il Foglio', 'la Repubblica', 'Il Messaggero', 'La Domenica del Corriere', 'La Stampa', 'Avanti!', 'La Gazzetta dello Sport', 'Liberazione']"
who is jason morgan married to in real life?	['Brenda Barrett']
where did nick clegg go to prep school?	['Caldicott School']
where was the ancient region of mesopotamia?	['Middle East']
who is the political leader of japan?	['Shinzō Abe']
what was james madison's job?	['United States Representative', 'United States Secretary of State', 'President of the United States']
who plays jackson gibbs on ncis?	['Ralph H. Waite']
what is the capital city of albania?	['Tirana']
what did chadwick identify?	['Neutron']
where was princess leia raised?	['Polis Massa']
what countries did germany take over during world war 2?	['France']
who owns the sf giants owner?	['Bill Neukom']
who was luke skywalker played by?	['Mark Hamill']
who did george lucas get engaged to?	['Mellody Hobson']
what kind of government does italy have?	['Constitutional republic', 'Parliamentary republic', 'Unitary state']
what state was theodore roosevelt from?	['New York']
who do rastafarians worship?	['Zion', 'Afrocentrism', 'Jah']
what form of government do we have in the usa?	['Presidential system', 'Federal republic', 'Representative democracy', 'Two-party system', 'Constitutional republic', 'Republic']
who is president of pakistan 2012?	['Asif Ali Zardari']
when was the last time the san francisco giants won a world series?	['2012 World Series']
what country is the mekong river located in?	['Thailand', 'Vietnam', 'Cambodia', 'Laos']
what type of political system does iran have?	['Islamic republic', 'Theocracy', 'Unitary state']
in what state did the bloody battle of antietam take place?	['Sharpsburg']
where is jay cutler now?	['Chicago Bears']
where is spain exactly located?	['Iberian Peninsula', 'Europe']
where does t boone pickens live?	['Oklahoma']
what position does ray allen?	['Shooting guard']
where did jack johnson go to high school?	['Kahuku High & Intermediate School']
who are the current senators from missouri?	['Claire McCaskill']
when was samuel pepys?	['United Kingdom']
what are some sights to see in rome?	"['Sistine Chapel', 'Piazza Navona', 'Roman Forum', 'Baths of Caracalla', ""Castel Sant'Angelo"", 'Bocca della Verità', 'Pantheon', ""St. Peter's Basilica"", 'Raphael Rooms', 'Colosseum']"
what awards has morgan freeman won?	['Golden Icon', 'National Board of Review Award for Best Actor', 'London Film Critics Circle Award for Best Actor', 'Golden Globe Award for Best Actor - Musical or Comedy Film', 'National Society of Film Critics Award for Best Supporting Actor', 'Kennedy Center Honor', 'Camie Award', 'NAACP Image Award for Outstanding Supporting Actor in a Motion Picture', 'Academy Award for Actor in a Supporting Role']
who played marty mcfly's dad?	['George McFly']
where is washington dc located what state?	['Maryland', 'Chevy Chase', 'Virginia', 'Northern Virginia', 'Arlington County']
what countries does armenia border?	['Turkey', 'Georgia', 'Azerbaijan']
what city is the state capital of washington?	['Olympia']
who is jennifer lawrence boyfriend 2012?	['Nicholas Hoult']
what company did henry ford work for?	['Ford Motor Company']
what is the time zone in uk now?	['Greenwich Mean Time', 'UTC±00:00']
where did michael jackson went to school?	['Montclair College Preparatory School']
what time is it in lake havasu city arizona?	['Mountain Time Zone']
what did shawnee smith play in?	"['The Grudge 3', 'Saw IV', 'Summer School', 'Saw II', 'Saw III', 'The Island', 'Saw', 'The Blob', ""Who's Harry Crumb?""]"
who played elaine on doc martin?	['Lucy Punch']
where was ancient carthage located?	['Tunisia']
which countries use euro money?	['Italy', 'Portugal', 'Finland', 'Luxembourg', 'France', 'Slovenia', 'Austria', 'Germany', 'Greece', 'Spain']
where does the zambezi river end?	['Indian Ocean']
what country does turkey trade with?	['Albania', 'Algeria']
who played the voice of aladdin?	['Scott Weinger']
who does mark sanchez play for?	['New York Jets']
what type of money does brazil have?	['Brazilian real']
what else is there in orlando besides disney?	['Baldwin Park']
who do nate robinson play for?	['Chicago Bulls']
what does shawn johnson do?	['Gymnast']
what airlines hub in phoenix?	['Phoenix Sky Harbor International Airport']
where was abraham lincoln buried?	['Oak Ridge Cemetery']
which college did obama graduated?	['Columbia University']
what type of tennis racket does john mcenroe use?	['One-handed backhand']
when did ian thorpe become famous?	['2000 Summer Olympics']
who did michael vick play for in 2008?	['United States Penitentiary, Leavenworth']
which states does the mississippi river pass through?	['Mississippi', 'Wisconsin', 'Minnesota', 'Kentucky', 'Illinois', 'Tennessee', 'Arkansas', 'Missouri', 'Iowa', 'Louisiana']
what kind of money does germany?	['Euro']
who does the author stephenie meyer play in the movie twilight?	['Woman at Wedding']
what season did jason priestley leave 90210?	['Beverly Hills, 90210 - Season 9']
where was selena gomez raised?	['Grand Prairie']
who's betty white?	['Singer', 'Television Producer', 'Author', 'Actor', 'TV Personality', 'Comedian']
what did martin luther do?	['Physician', 'Theologian', 'Professor', 'Writer', 'Monk', 'Priest']
where are john deere snow blowers made?	['Moline']
who plays nana in the royal family?	['Anna Tsuchiya']
when did aldi originate?	['1961']
what book did niccolo machiavelli write?	['The Prince']
what is the currency name of china?	['Renminbi']
where was the earthquake in christchurch?	['Canterbury']
when did the bali bombings occur?	['2002 Bali bombings']
what are the airports in chicago?	"['Lansing Municipal Airport', ""O'Hare International Airport"", 'Chicago Midway International Airport', 'Chicago Executive Airport', 'Schaumburg Regional Airport', 'Aurora Municipal Airport', 'Lewis University Airport', 'Gary/Chicago International Airport', 'Waukegan Regional Airport']"
what does qatar export?	['Organization of Arab Petroleum Exporting Countries']
what sea does the yangtze river flow into?	['East China Sea']
what is shakira's nationality?	['Colombia']
what year did tim duncan enter the nba?	['1997–98 NBA season']
what was the cause of death for edgar allan poe?	['Tuberculosis']
where did the oakland raiders move from?	['Los Angeles']
what did susan atkins die of?	['Brain tumor', 'Cancer']
what are the major imports and exports of canada?	['Bituminous Coal Underground Mining', 'Copper Ore and Nickel Ore Mining', 'Automobile', 'Pulp, Paper, and Paperboard Mills', 'Wheat Farming', 'Electric Power Generation', 'Crude Petroleum and Natural Gas Extraction', 'Iron Ore Mining', 'Primary Aluminum Production', 'Pharmaceutical and Medicine Manufacturing']
what movie queen latifah play in?	['Taxi', 'Jungle Fever', 'Set It Off', 'Stranger than Fiction', 'Last Holiday', 'Brown Sugar', 'Ice Age: The Meltdown', 'Ice Age: Dawn of the Dinosaurs', 'Hairspray', 'Bringing Down the House']
where did dolly parton grew up?	['Sevierville']
who started the first persian gulf war?	['Kuwait']
what form of government does brazil have?	['Constitutional republic', 'Presidential system', 'Federal republic']
what years did barry bonds play?	['2001 Major League Baseball Season', '1990 Major League Baseball Season', '1996 Major League Baseball Season', '1993 Major League Baseball Season', '1992 Major League Baseball Season', '2002 Major League Baseball Season', '2003 Major League Baseball season', '2004 Major League Baseball season', '1998 Major League Baseball Season']
what timezone is new mexico currently in?	['Mountain Time Zone', 'UTC−07:00']
where robert frost went to school?	['Dartmouth College', 'University of Oxford', 'Harvard University', 'University of Cambridge', 'Bates College']
what bella name her baby?	['Renesmee Carlie Cullen']
what year did aaron rodgers get drafted?	['2005 NFL Draft']
when did shawn johnson won the gold medal?	['2008 Summer Olympics']
what timezone is new england usa in?	['North American Eastern Time Zone']
where did dmitri mendeleev teach?	['Saint Petersburg State Institute of Technology']
where to eat in miami florida?	['S & S Sandwich Shop']
what continent is the usa located in?	['North America']
who does dominic monaghan play in lord of the rings?	['Meriadoc Brandybuck']
where was st elizabeth ann seton born?	['New York City']
who was the voice of darth vader in episode iii?	['Hayden Christensen']
who was andy williams second wife?	['Debbie Meyer']
where are you if you re in zagreb?	['Croatia']
where are you from in egyptian arabic?	['Egypt']
what market does starbucks operate in?	['Cafe / Coffee Shop', 'American food', 'Bakery', 'Delicatessen', 'Bagels']
what did darwin propose as the mechanism of evolution?	['It is not the strongest of the species that survives, nor the most intelligent, but the one most responsive to change.']
what political system is in china?	['Communist state']
where did anne frank live before the war?	['Frankfurt']
what is jonas brothers names?	['Nick Jonas', 'Kevin Jonas', 'Joe Jonas']
where did trey songz go to high school?	['Petersburg High School']
what is the currency in the dominican republic 2010?	['Dominican peso']
what is the money called in peru?	['Peruvian nuevo sol']
what country does iceland belong to?	['Iceland']
where did matt barnes play?	['Small forward']
where to stay near asheville?	['Grove Park Inn']
what were erik erikson's theories?	['Developmental psychology']
when did kennedy get elected?	['John F. Kennedy 1961 presidential inauguration']
what percent of mississippi is black?	['Yoknapatawpha County', 'Caldecott County']
what did bella abzug do?	['Lawyer']
where did the battle of the alamo start?	['San Antonio']
who is paul mccartney's current wife?	['Nancy Shevell']
who does russia trade with the most?	['Uzbekistan']
what kind of money does the ivory coast use?	['West African CFA franc']
where are the mines in victoria?	['Victoria']
what movies has halle berry starred in?	"['Jungle Fever', 'Catwoman', 'Gothika', 'Executive Decision', 'Robots', 'Introducing Dorothy Dandridge', 'B*A*P*S', 'Bulworth', 'Race the Sun', ""Monster's Ball""]"
when are the australian open men's finals?	['Yearly']
what is the zip code for minneapolis?	['55406', '55407', '55409', '55408', '55410', '55411', '55405', '55403', '55402', '55401']
what kind of government system does canada have?	['Parliamentary system', 'Federation', 'Constitutional monarchy', 'Multi-party system']
what do they speak in iran?	['Turkmen Language', 'Pashto language', 'Kurdish language', 'Gilaki Language', 'Assyrian Neo-Aramaic Language', 'Azerbaijani language', 'Armenian Language', 'Persian Language', 'Mazanderani Language', 'Luri language']
when did joe walsh leave the eagles?	['1980']
what position did george washington serve in the constitutional convention?	['Delegate to the Continental Congress']
what timezone is minneapolis in?	['Central Time Zone']
where does frida kahlo live now?	['Coyoacán']
where is auburn university at?	['Alabama', 'Auburn University Historic District', 'United States of America', 'Auburn']
what is the newspaper in phoenix?	['The Catholic Sun', 'The Arizona Republic', 'Phoenix New Times', 'Phoenix Gazette']
where does selena gomez live right now 2010?	['New York City']
when was george h.w. bush elected president?	['1/20/1993']
what type of currency should i take to mexico?	['Mexican peso']
what is the timezone in england called?	['Greenwich Mean Time']
what schools did barack obama attend?	['Occidental College', 'Harvard Law School', 'Noelani Elementary School', 'Punahou School', 'State Elementary School Menteng 01', 'St. Francis of Assisi Catholic School', 'Columbia University']
who is robert downey jr wife?	['Susan Downey']
who will win the 2011 nhl stanley cup?	['Canada']
where are sunbeam appliances made?	['Canada', 'United States of America']
what did michael faraday accomplish?	['Experimental researches in electricity']
who makes lois griffin voice?	['Alex Borstein']
what was lebron james rookie year?	['2003–04 NBA season']
what tourist attractions are in houston texas?	['George R. Brown Convention Center', 'Sam Houston Race Park', 'Rothko Chapel', 'Kemah Boardwalk', 'Space Center Houston', 'Downtown Aquarium, Houston', 'Hanna–Barbera Land', 'Bayou Bend', 'SplashTown Houston', 'Houston Zoo']
what country was anton van leeuwenhoek from?	['Dutch Republic', 'Netherlands']
who did u.s. fight against in ww1?	['United Kingdom', 'Australia', 'Italy', 'Russia', 'France']
where is the columbia university located?	['New York']
what money do they use in chile?	['Chilean peso']
what is the currency in croatia 2012?	['Croatian kuna']
what does michael vick do?	['American football player']
when did mcgee start on ncis?	['NCIS - Season 1']
where did martin luther king jr get shot?	['Memphis']
what type of government system does saudi arabia have?	['Absolute monarchy', 'Islamic state', 'Unitary state']
what type of currency does egypt have?	['Egyptian pound']
who was vladimir lenin and why was he important?	['Revolutionary', 'Politician', 'Economist', 'Lawyer', 'Philosopher']
what city was nelson mandela born in?	['Mvezo']
what gauge strings john mayer?	['Blues-rock']
what influenced andy warhol's work?	['Jasper Johns', 'Jack Smith', 'Truman Capote', 'Tom of Finland', 'Ben Shahn', 'Marcel Duchamp']
what time zone is anaheim ca?	['Pacific Time Zone']
where did romans go?	['Europe']
what language do people speak in brazil wikipedia?	['Brazilian Portuguese', 'Portuguese Language', 'Italian Language']
what airport do you fly into for destin?	['Northwest Florida Regional Airport', 'Destin–Fort Walton Beach Airport']
who was vice president under ronald reagan?	['George H. W. Bush']
what land did god promise joshua?	['Canaan']
who did the cleveland browns draft?	['Jeff Faine', 'Kellen Winslow II', 'Braylon Edwards', 'Kamerion Wimbley', 'Brady Quinn', 'Joe Thomas']
what year did us invaded iraq?	['2003 invasion of Iraq']
where did jennifer hudson go to school?	['Dunbar Vocational High School', 'Langston University']
who is the elected governor of california?	['Jerry Brown']
who is the voice of stewie griffin from family guy?	['Seth MacFarlane']
who drafted kevin garnett?	['Minnesota Timberwolves']
who is the governor of kentucky 2012?	['Steve Beshear']
where is mount jefferson located?	['Jefferson County', 'United States of America', 'Linn County', 'Oregon', 'Marion County']
which countries are part of the united kingdom?	['Eurasia', 'Western Europe', 'United Kingdom, with Dependencies and Territories']
what office does boehner hold?	['Member of Congress']
when is summer in australia sydney?	['City of Sydney']
where did the seminole native americans live?	['Indigenous peoples of the Southeastern Woodlands']
what city uses gmt?	['Codicote', 'Ballincollig', 'Reykjavik', 'Iceland', 'Booterstown', 'WF1 1HS', 'Oxford', 'Halifax', 'Glasgow', 'Harpenden']
where is german an official language?	['Canada', 'German Democratic Republic', 'Luxembourg', 'Switzerland', 'Liechtenstein', 'Germany', 'West Germany', 'Belgium', 'Vatican City', 'Second Polish Republic']
what college did lee corso attend?	['Florida State University']
what countries are part of nato?	['Netherlands', 'Poland', 'United States of America', 'United Kingdom', 'Germany', 'Bulgaria']
what is the name of the pittsburgh steelers head coach?	['Mike Tomlin']
what happened to sir thomas cromwell?	['Decapitation']
who voiced meg in the pilot?	['Mila Kunis']
who played boss hogg dukes of hazzard?	['Sorell Booke']
what did barack obama do before he took office?	['Illinois State Senator']
what kind of biome is the everglades?	['Wetland']
where did wassily kandinsky work?	['University of Tartu', 'Bauhaus']
what countries are on the mediterranean sea?	['Italy', 'Spain', 'France']
who does kurt busch drive for now?	['Miller Lite']
what website did mark zuckerberg co founder?	['Facebook']
what are the different dialects of chinese?	['Qingtian dialect', 'Standard Mandarin']
who is married to jane krakowski?	['Robert Godley']
who are shakespeare's parents names?	['John Shakespeare', 'Mary Shakespeare']
what currency does jamaica accept?	['Jamaican dollar']
what year was the new york blackout?	['New York City blackout of 1977']
what position did john stockton play?	['Point guard']
when did sanchez leave usc?	['2009 NFL season']
who was wale signed to?	['Def Jam Recordings', 'Warner Bros. Records', 'Roc Nation', 'Allido Records', 'Interscope Records']
where is usc from?	['United States of America', 'California', 'Los Angeles']
who started twa airlines?	['Howard Hughes']
when is the gold cup cheltenham?	['Yearly']
what team does luis suarez play for?	['Liverpool F.C.']
where do the san francisco giants play baseball?	['Polo Grounds', 'Polo Grounds III', 'Polo Grounds II', 'Seals Stadium', 'Candlestick Park', 'Hilltop Park', 'St. George Cricket Grounds', 'Polo Grounds IV', 'AT&T Park']
what party was woodrow wilson from?	['Democratic Party']
who's kobe bryant?	['Basketball player']
what to see near sedona arizona?	['Sedona Airport', 'Red Rock State Park', 'Seven Canyons', 'Honanki', 'Cathedral Rock', 'Chapel of the Holy Cross', 'Sycamore Canyon', 'Oak Creek Canyon', 'Slide Rock State Park', 'Bell Rock']
when did romney first run for president?	['Mitt Romney presidential campaign, 2008']
where george washington carver go to school?	['Tuskegee University', 'Iowa State University', 'Simpson College']
where did bronx tale take place?	['The Bronx']
during what war did abraham lincoln serve as president?	['American Civil War']
what countries did andy warhol work?	['United States of America']
how much does the average american pay in taxes over their lifetime?	"['American National Biography', '47 Percenters and Guerrilla Decontextualization (Part 1): Dreams and Nightmares', ""Why Race Mattered in Barack Obama's Re-election""]"
who currently owns the steelers?	['Rooney family']
who did heinrich himmler marry?	['Margarete Boden']
what is the name of currency used in spain?	['Euro']
